{
  "$schema": "https://json-schema.org/draft/2020-12/schema",
  "$id": "https://goobers.dev/schemas/invocation.schema.json",
  "title": "InvocationEnvelope",
  "description": "The V0 stage invocation envelope: what the runner hands a stage when the workflow advances (ARCHITECTURE.md §5). Carries context POINTERS only — never upstream result bodies (§2.4).",
  "type": "object",
  "additionalProperties": false,
  "required": ["taskId", "workflowId", "runId", "gaggle", "goal", "workspace", "repoRef", "limits"],
  "allOf": [
    {
      "if": { "required": ["nestedAgentPolicy"] },
      "then": { "required": ["attempt", "goober", "ownershipBoundary", "parentPlatformPolicy"] }
    },
    {
      "if": { "required": ["childWorkflowOrigin"] },
      "then": { "required": ["attempt", "goober", "ownershipBoundary"] }
    }
  ],
  "properties": {
    "childWorkflowOrigin": {
      "type": "object",
      "description": "Runner-authored durable parent occurrence and dispatch identities; contains no credentials or policy grants.",
      "additionalProperties": false,
      "required": ["stageOccurrence", "attemptId"],
      "properties": {
        "stageOccurrence": {
          "type": "string",
          "pattern": "^sta_[A-Za-z0-9_-]{43}$",
          "examples": ["sta_AAAAAAAAAAAAAAAAAAAAAAAAAAAAAAAAAAAAAAAAAAA"],
          "description": "Identity of the first committed stage start for this task visit and branch; retained across retry, recovery and human restart."
        },
        "attemptId": {
          "type": "string",
          "pattern": "^sta_[A-Za-z0-9_-]{43}$",
          "examples": ["sta_AAAAAAAAAAAAAAAAAAAAAAAAAAAAAAAAAAAAAAAAAAA"],
          "description": "Identity bound to the current committed stage-start event; changes for each replacement dispatch without granting child authority."
        }
      }
    },
    "artifactPublication": {
      "type": "object",
      "description": "Runner-owned DSL 3.1 publication contract, pinned to the stage visit.",
      "additionalProperties": false,
      "required": [
        "stage",
        "visit",
        "slots"
      ],
      "properties": {
        "stage": {
          "type": "string",
          "minLength": 1,
          "description": "Producing task name from the admitted workflow."
        },
        "visit": {
          "type": "integer",
          "minimum": 1,
          "description": "Opaque run/stage-scoped identity also journaled on stage.started."
        },
        "slots": {
          "type": "array",
          "minItems": 1,
          "maxItems": 64,
          "items": {
            "type": "object",
            "additionalProperties": false,
            "required": [
              "name"
            ],
            "properties": {
              "name": {
                "type": "string",
                "pattern": "^[A-Za-z0-9_-]{1,128}$",
                "description": "Stable producer-local slot handle."
              },
              "mediaType": {
                "type": "string",
                "minLength": 1,
                "description": "Declared media type, when specified."
              },
              "schemaPath": {
                "type": "string",
                "minLength": 1,
                "description": "Pinned schema declaration; content validation is a consumer concern."
              },
              "maxSize": {
                "type": "integer",
                "minimum": 0,
                "description": "Declared byte ceiling, when positive."
              }
            }
          },
          "description": "Required producer-local declarations pinned from the admitted task."
        }
      }
    },
    "taskId": { "type": "string", "minLength": 1, "description": "Stage instance identifier within this run." },
    "attempt": { "type": "integer", "minimum": 1, "description": "Stage attempt number used for retry-safe provenance. Omitted only by legacy callers, which default to attempt 1." },
    "workflowId": { "type": "string", "minLength": 1, "description": "Workflow definition identifier being executed." },
    "dslVersion": { "type": "string", "pattern": "^[0-9]+\\.[0-9]+$", "description": "Workflow DSL version whose semantics govern this invocation. Omitted preserves legacy behavior." },
    "runId": { "type": "string", "minLength": 1, "description": "Run identifier, also used as the run's OpenTelemetry trace ID." },
    "instanceId": {
      "type": "string", "pattern": "^[0-9a-f]{32}$",
      "examples": ["0123456789abcdef0123456789abcdef"],
      "not": { "const": "00000000000000000000000000000000" },
      "description": "Durable originating instance identity pinned at run admission; absent for legacy runs."
    },
    "triggerRef": {
      "type": "string",
      "minLength": 1,
      "description": "The event or item that caused the run. Bounded scheduler metadata only, never the provider's raw trigger payload."
    },
    "gaggle": { "type": "string", "minLength": 1, "description": "Gaggle this run belongs to." },
    "branchNamespace": {
      "type": "string",
      "description": "The gaggle's run-branch namespace root (GaggleSpec.BranchNamespace); empty means the default 'goobers/'. Injected as GOOBERS_BRANCH_NAMESPACE (#965/#1010)."
    },
    "baseBranch": {
      "type": "string",
      "description": "The gaggle's configured default branch (GaggleSpec.Project.Branch/RepoRef.Branch); empty means the default 'main'. Injected as GOOBERS_BASE_BRANCH (#2087)."
    },
    "goober": { "type": "string", "minLength": 1, "description": "Goober this invocation is for; absent for a deterministic stage or an automated gate. The local runner dispatches from the workflow definition and never needed it on the wire; a Temporal worker has only the envelope, so without it the agentic seam cannot resolve which goober to construct." },
    "configGeneration": { "type": "string", "pattern": "^sha256:[0-9a-f]{64}$", "description": "Content address of this run’s immutable execution configuration archive." },
    "gooberDigest": {
      "type": "string",
      "pattern": "^sha256:[0-9a-f]{64}$",
      "description": "Content digest of the goober kit this run was admitted against (run.yaml's gooberDigest); absent for a run started before the pin existed, which resolves the worker's current config tree unchanged. A SELECTOR, not decoration: the worker serves the config tree whose goober digest equals this value or refuses the attempt by name (gate_pin_missing / run_pin_unverifiable) rather than silently substituting its currently-configured goober (#3884)."
    },
    "goal": { "type": "string", "minLength": 1, "description": "Intended outcome of this stage, copied from its workflow definition." },
    "reviewerDeferralAllowed": { "type": "boolean", "description": "Runner-owned capability derived from the reviewer gate's declared deferral branch; enables the expanded reviewer completion vocabulary for this invocation only." },
    "reviewerMechanicalEscalationAllowed": { "type": "boolean", "description": "Runner-owned capability for typed mechanical stops, enabled only when the gate explicitly declares both expanded deferral and escalation routes." },
    "attempt": { "type": "integer", "minimum": 1, "description": "One-based attempt number for this stage execution." },
    "ownershipBoundary": { "type": "string", "minLength": 1, "description": "Runner-authored boundary identifying the work this invocation owns." },
    "instructionAddendum": {
      "type": "string",
      "minLength": 1,
      "description": "An operator-supplied, one-off addition to the agent instructions for this invocation. Never persisted to the workflow definition."
    },
    "workspace": {
      "type": "string",
      "minLength": 1,
      "description": "Absolute path to the fresh, isolated, disposable working copy the stage runs in (§5)."
    },
    "item": { "$ref": "#/$defs/backlogItem", "description": "Bounded provider-neutral descriptor of the backlog item that started the run. Omitted when no item triggered the run." },
    "repoRef": { "$ref": "#/$defs/repoRef", "description": "Primary repository targeted by this run." },
    "workspaceRevision": {
      "description": "Optional immutable selected-revision authority; absent preserves legacy behavior.",
      "$ref": "workspace-revision.schema.json"
    },
    "additionalWorkspaces": {
      "type": "array",
      "description": "Read-only checkouts of the gaggle's reference repos (GaggleSpec.AdditionalRepos, MGV-11 #1286). The stage may read them; no push credential is provisioned, so they are read-only by construction. Surfaced as GOOBERS_ADDITIONAL_REPO_<UPPER_SANITIZED_NAME>=<path>.",
      "items": { "$ref": "#/$defs/additionalWorkspace" }
    },
    "checkoutCones": {
      "type": "object",
      "description": "Present only when the runner honored a project.checkout.sparse declaration (#649): repo-relative path cones actually materialized, keyed by workspace identity ('' for the primary workspace, else the matching additionalWorkspaces[i].name). A workspace absent from this object has a full checkout.",
      "additionalProperties": {
        "type": "array",
        "items": { "type": "string", "minLength": 1 },
        "minItems": 1
      }
    },
    "contextPointers": {
      "type": "array",
      "description": "Read-only inputs: journal artifact pointers and external refs. Pointers only.",
      "items": { "$ref": "#/$defs/contextPointer" }
    },
    "minimumIntegrity": {
      "type": "string",
      "enum": ["trusted", "maintainer", "unapproved", "derived"],
      "description": "Lowest input-integrity grade the stage accepts. The runner refuses lower-graded input before dispatch."
    },
    "capabilities": {
      "type": "array",
      "description": "Declared capability grants (e.g. 'github:issues:write'). Undeclared use fails closed (§5).",
      "items": {
        "type": "string",
        "enum": [
          "repo:read",
          "repo:push",
          "configrepo:write",
          "github:issues:read",
          "github:issues:write",
          "github:milestones:write",
          "github:issues:approve",
          "provider:pr:write",
          "github:pr:read",
          "github:pr:write",
          "github:pr:review",
          "provider:ci:cancel",
          "github:branch:delete",
          "github:pr:merge",
          "contents:read",
          "github:code-scanning:read",
          "github:dependabot-alerts:read",
          "ado:code:read",
          "ado:pr:comment",
          "ado:pr:write",
          "ado:pr:status",
          "ado:pr:complete",
          "ado:work-items:write",
          "ado:packaging:read",
          "telemetry:read",
          "journal:read",
          "agent:model"
        ]
      }
    },
    "policyActions": {
      "type": "array",
      "description": "Runner-admitted externally mutating actions available to this stage.",
      "items": { "type": "string", "minLength": 1 }
    },
    "parentPlatformPolicy": {
      "$ref": "workflow.schema.json#/$defs/task/properties/nestedAgentPolicy/properties/platformPolicy",
      "description": "Runner-derived parent authority used to admit a nested child. Never derived from nestedAgentPolicy."
    },
    "limits": { "$ref": "#/$defs/limits", "description": "Execution and agent-usage limits applied to this stage." },
    "nestedAgentPolicy": {
      "$ref": "workflow.schema.json#/$defs/task/properties/nestedAgentPolicy",
      "description": "Admitted nested-agent authority carried in the mandatory execution envelope."
    },
    "inputs": {
      "type": "object",
      "description": "The stage's static config from its definition. The stage's own config — not another stage's state. Unlike result.schema.json's outputs (scalar-bounded by schema), inputs is intentionally unconstrained: the anti-smuggling invariant here is convention-backed, not schema-enforced, because the runner deliberately routes a gate's subject-stage status/outputs through a gate's own inputs (internal/runner's flattening into env.Inputs before an automated/agentic gate evaluation, internal/gate.InputKeyStatus) — a small, scalar-only, one-directional bridge, not the general reach-through §2.4 forbids (#125)."
    }
  },
  "$defs": {
    "backlogItem": {
      "type": "object",
      "description": "Provider-neutral snapshot descriptor for the item that triggered the run; the content-digested snapshot remains in the journal.",
      "additionalProperties": false,
      "required": ["id", "provider"],
      "properties": {
        "id": { "type": "string", "minLength": 1, "description": "Provider-native item identifier, such as an issue or work-item number." },
        "provider": { "type": "string", "enum": ["github", "ado", "gitea"], "description": "Provider the item came from." },
        "title": { "type": "string", "description": "Short item title." },
        "body": { "type": "string", "description": "Item description or details." },
        "url": { "type": "string", "description": "Provider URL for the item." },
        "labels": { "type": "array", "description": "Provider labels attached to the item.", "items": { "type": "string" } },
        "integrity": {
          "type": "string",
          "enum": ["trusted", "maintainer", "unapproved", "derived"],
          "description": "Provenance grade of the provider-authored title/body."
        }
      }
    },
    "additionalWorkspace": {
      "type": "object",
      "description": "Read-only checkout of one gaggle reference repository supplied alongside the primary workspace.",
      "additionalProperties": false,
      "required": ["name", "path"],
      "properties": {
        "name": { "type": "string", "minLength": 1, "description": "Reference repository name from the gaggle definition." },
        "path": { "type": "string", "minLength": 1, "description": "Absolute path to the read-only checkout." }
      }
    },
    "repoRef": {
      "type": "object",
      "description": "Provider-neutral repository identity. It carries no credential.",
      "additionalProperties": false,
      "required": ["provider", "owner", "name"],
      "properties": {
        "provider": { "type": "string", "enum": ["github", "ado", "gitea"], "description": "Repository provider." },
        "baseUrl": { "type": "string", "description": "Forge root URL (e.g. https://gitea.example.com); required when provider is gitea, since self-hosted Gitea has no fixed host. Absent when provider is github: GitHub Enterprise Server is unsupported and config validation refuses a github baseUrl, so a github reference always means github.com." },
        "owner": { "type": "string", "minLength": 1, "description": "GitHub organization or user, Gitea owner, or Azure DevOps organization." },
        "project": { "type": "string", "description": "Azure DevOps project containing the repository." },
        "name": { "type": "string", "minLength": 1, "description": "Repository name." },
        "branch": { "type": "string", "description": "Default branch checked out and targeted by the run." },
        "connectionRef": { "type": "string", "description": "Name of a Manifest connection. Accepted but not yet used to source credentials: stage credentials come from instance.yaml repos[], credentials[] and secretStores. Connection-level credentials are planned (docs/design/provider-access-layer.md)." }
      }
    },
    "limits": {
      "type": "object",
      "description": "Stage execution limits. Zero values mean no explicit limit.",
      "additionalProperties": false,
      "properties": {
        "maxDurationSeconds": { "type": "integer", "minimum": 0, "description": "Maximum stage wall-clock duration in seconds." },
        "maxTokens": { "type": "integer", "minimum": 0, "description": "Maximum model tokens the stage may consume." },
        "maxCostUSD": { "type": "number", "minimum": 0, "description": "Maximum model spend in US dollars." }
      }
    },
    "contextPointer": {
      "type": "object",
      "additionalProperties": false,
      "required": ["name"],
      "description": "Exactly one of artifact or external.",
      "properties": {
        "name": { "type": "string", "minLength": 1, "description": "Logical handle the stage uses to refer to this input." },
        "branch": {
          "type": "integer",
          "minimum": 1,
          "description": "Declaration-ordered id of the parallel branch that produced this artifact. Present only on artifacts fanned into a join."
        },
        "branchName": {
          "type": "string",
          "minLength": 1,
          "description": "Declared name of the parallel branch that produced this artifact. Paired with branch."
        },
        "integrity": {
          "type": "string",
          "enum": ["trusted", "maintainer", "unapproved", "derived"],
          "description": "Provenance grade evaluated by stage input admission."
        },
        "artifact": { "$ref": "artifact-pointer.schema.json", "description": "Pointer to a digest-verified artifact in this run or the run named by runId." },
        "external": { "$ref": "#/$defs/externalRef", "description": "Locator for a resource outside the run journal, such as an issue or pull request." },
        "runId": {
          "type": "string",
          "description": "The run whose journal `artifact` lives in, when it is NOT this stage's own run (cross-run evidence resolution, #103/T3). Empty/absent means the artifact is this run's own upstream output. A non-empty value crosses a trust boundary and requires the journal:read capability, enforced by the harness. Mirrors ContextPointer.RunID (Go); present here so a valid cross-run envelope passes this closed schema (#125)."
        }
      },
      "dependentRequired": {
        "branch": ["branchName"],
        "branchName": ["branch"]
      },
      "oneOf": [
        { "required": ["artifact"], "not": { "required": ["external"] } },
        { "required": ["external"], "not": { "required": ["artifact"] } }
      ],
      "allOf": [
        { "if": { "required": ["branch"] }, "then": { "required": ["branchName", "artifact"] } },
        { "if": { "required": ["branchName"] }, "then": { "required": ["branch"] } }
      ]
    },
    "externalRef": {
      "type": "object",
      "description": "Content-free locator for a resource outside the run journal.",
      "additionalProperties": false,
      "required": ["kind", "uri"],
      "properties": {
        "kind": { "type": "string", "minLength": 1, "description": "Reference category, such as issue, pull-request, or url." },
        "uri": { "type": "string", "minLength": 1, "description": "Resource locator." },
        "description": { "type": "string", "description": "Optional human-facing label for the reference." }
      }
    }
  }
}
